{
  "extractionStatus": "success",
  "documentRevision": "C",
  "lineCount": 44,
  "lines": [
    {
      "lineNumber": 15,
      "itemRef": "",
      "isAlternate": false,
      "alternateVariant": "",
      "productFamily": "",
      "roomType": "Main Bathroom",
      "unitTier": "Penthouse",
      "specifiedText": "Havelock Basin",
      "specifiedBrand": "Havelock",
      "specifiedModel": "09BN006",
      "specifiedFinish": "Gloss White",
      "quantity": 12,
      "cutoutW": 0,
      "cutoutH": 0,
      "cutoutD": 0,
      "notes": "",
      "extractionConfidence": 0.97
    },
    {
      "lineNumber": 17,
      "itemRef": "",
      "isAlternate": false,
      "alternateVariant": "",
      "productFamily": "",
      "roomType": "Kitchen",
      "unitTier": "Standard",
      "specifiedText": "Thornbury 450mm Dishwasher",
      "specifiedBrand": "Thornbury",
      "specifiedModel": "04DW4501X",
      "specifiedFinish": "Gloss White",
      "quantity": 138,
      "cutoutW": 450,
      "cutoutH": 590,
      "cutoutD": 560,
      "notes": "",
      "extractionConfidence": 0.97
    },
    {
      "lineNumber": 20,
      "itemRef": "",
      "isAlternate": false,
      "alternateVariant": "",
      "productFamily": "",
      "roomType": "Main Bathroom",
      "unitTier": "Standard",
      "specifiedText": "Basin Mixer, gloss white, or equal approved",
      "specifiedBrand": "",
      "specifiedModel": "",
      "specifiedFinish": "Gloss White",
      "quantity": 138,
      "cutoutW": 0,
      "cutoutH": 0,
      "cutoutD": 0,
      "notes": "",
      "extractionConfidence": 0.95
    }
  ]
}